{
  "schema": "fixture-expect/1",
  "project": "FX-EXT",
  "variant": "secret",
  "expectations": [
    {
      "check": "sec.secrets.files",
      "result": "أخفق",
      "rule": null,
      "rule_pending": true,
      "tool_rule": "generic-api-key",
      "location": {
        "path": "src/config.ts",
        "line": 2,
        "anchor": "API_KEY"
      },
      "confidence": "مخالفة مثبتة",
      "origin": "المشروع",
      "reason": "تطابق عالي الثقة مع فاحص الأسرار (Gitleaks 8.30.1: generic-api-key)"
    },
    {
      "check": "code.build",
      "result": "اجتاز",
      "rule": null,
      "rule_pending": true,
      "location": null,
      "confidence": null
    },
    {
      "check": "beh.unit",
      "result": "اجتاز",
      "rule": null,
      "rule_pending": true,
      "location": null,
      "confidence": null
    }
  ]
}
