{
  "schema": "fixture-expect/1",
  "project": "FX-EXT",
  "variant": "vuln-dep",
  "expectations": [
    {
      "check": "sec.deps",
      "result": "أخفق",
      "rule": null,
      "rule_pending": true,
      "location": {
        "path": "package.json",
        "line": 17,
        "anchor": "ayar-vuln-fake"
      },
      "confidence": "مخالفة مثبتة",
      "origin": "المشروع",
      "reason": "ثغرة تجريبية في ayar-vuln-fake@1.0.0: AYAR-2026-0001 في قاعدة OSV المصغرة (fixtures/tools/osv-mini-db)",
      "requires": [
        "osv-mini-db"
      ]
    }
  ]
}
