{
  "schema": "fixture-expect/1",
  "project": "FX-PY",
  "variant": "good",
  "summary": "لا اكتشافات في النسخة السليمة.",
  "expectations": [
    {
      "check": "beh.unit",
      "result": "اجتاز",
      "rule": null,
      "location": null,
      "confidence": null
    },
    {
      "check": "beh.stability",
      "result": "اجتاز",
      "rule": null,
      "location": null,
      "confidence": null
    },
    {
      "check": "code.lint",
      "result": "اجتاز",
      "rule": null,
      "location": null,
      "confidence": null
    },
    {
      "check": "code.types",
      "result": "اجتاز",
      "rule": null,
      "location": null,
      "confidence": null
    },
    {
      "check": "code.build",
      "result": "اجتاز",
      "rule": null,
      "location": null,
      "confidence": null
    },
    {
      "check": "code.refs.local",
      "result": "اجتاز",
      "rule": null,
      "location": null,
      "confidence": null
    },
    {
      "check": "sec.secrets.files",
      "result": "اجتاز",
      "rule": null,
      "location": null,
      "confidence": null
    },
    {
      "check": "integ.guard",
      "result": "اجتاز",
      "rule": null,
      "location": null,
      "confidence": null,
      "reason": "الجولة الأولى: لا أساس للمقارنة"
    },
    {
      "check": "sec.deps",
      "result": "اجتاز",
      "rule": null,
      "location": null,
      "confidence": null,
      "requires": [
        "osv-mini-db"
      ]
    }
  ]
}
