{
  "schema": "fixture-expect/1",
  "project": "FX-ADAPTERS",
  "variant": "vitest--no-inputs",
  "expectations": [
    {
      "check": "beh.unit",
      "component": "vitest",
      "result": "ناقص",
      "rule": null,
      "location": null,
      "confidence": null,
      "exit_code": 1,
      "reason": "No test files found (AT-14)"
    }
  ]
}
