{
  "schema": "fixture-expect/1",
  "project": "FX-ADAPTERS",
  "variant": "playwright--no-inputs",
  "expectations": [
    {
      "check": "beh.e2e",
      "component": "playwright",
      "result": "غير منطبق",
      "rule": null,
      "location": null,
      "confidence": null,
      "reason": "لا اختبارات رحلات في المشروع: beh.e2e لا ينطبق (الخطة 10.3: «مشروع فيه اختبارات رحلات Playwright»، و«بشرط: وجودها»). ولو شُغّل لكان «No tests found» برمز 1 ← ناقص"
    }
  ]
}
