{
  "schema": "fixture-expect/1",
  "project": "FX-EXT",
  "variant": "flaky-vitest",
  "expectations": [
    {
      "check": "beh.stability",
      "result": "متذبذب",
      "rule": null,
      "rule_pending": true,
      "location": {
        "path": "src/lib/flaky.test.ts",
        "line": 19,
        "anchor": "يستجيب للطلب المتقطع"
      },
      "confidence": "مخالفة مثبتة",
      "reason": "نتيجة الاختبار تتناوب بين التكرارات (AT-15)"
    },
    {
      "check": "beh.unit",
      "result": "أخفق",
      "rule": null,
      "rule_pending": true,
      "location": {
        "path": "src/lib/flaky.test.ts",
        "line": 19,
        "anchor": "يستجيب للطلب المتقطع"
      },
      "confidence": "مخالفة مثبتة",
      "origin": "المشروع",
      "reason": "في التشغيل المنفرد الأول (رقم 0) يفشل؛ ويتبدل بحسب رقم التشغيل"
    }
  ]
}
