{
  "schema": "fixture-expect/1",
  "project": "FX-ADAPTERS",
  "variant": "vitest--conflict",
  "expectations": [
    {
      "check": "beh.unit",
      "component": "vitest",
      "result": "تعذّر",
      "rule": null,
      "location": {
        "path": "vitest/test/add.test.js",
        "line": 4,
        "anchor": "يجمع عددين"
      },
      "confidence": null,
      "origin": "الأداة",
      "exit_code": 0,
      "reason": "تعارض الأدلة: خروج 0 والتقرير فيه إخفاق (الخطة 7.3 القاعدة 5)"
    }
  ]
}
